{
  "commandType": "AttachFile",
  "workspaceId": "11111111-1111-4111-8111-111111111111",
  "correlationId": "22222222-2222-4222-8222-222222222222",
  "idempotencyKey": "attach-file-1",
  "payload": {
    "objectId": "33333333-3333-4333-8333-333333333333",
    "filename": "quote.pdf",
    "contentType": "application/pdf",
    "sizeBytes": 7,
    "sha256": "aaaaaaaaaaaaaaaaaaaaaaaaaaaaaaaaaaaaaaaaaaaaaaaaaaaaaaaaaaaaaaaa",
    "storageKey": "aa/aa/aaaaaaaaaaaaaaaaaaaaaaaaaaaaaaaaaaaaaaaaaaaaaaaaaaaaaaaaaaaaaaaa"
  }
}
